{
  "$schema": "../../../contracts/schemas/evidence-envelope.schema.json",
  "schema_id": "mdplace.evidence-envelope/v1",
  "envelope_id": "evidence:codex-adapter-profile",
  "extension_id": "mdplace.validator-extension/evidence/v1",
  "package_series": "mdplace-spec/v1",
  "release_version": "1.0.0",
  "validator_id": "mdplace.package-validator",
  "validator_version": "1.2.0",
  "invocation": {
    "invocation_id": "invocation:codex-adapter-profile",
    "path": "conformance/evidence/invocations/codex-adapter-profile.json",
    "sha256": "8f7d8d8ee40be82e9d4b475bf92aaea5e0a32928ae6b2985d142ded104dc9cfb"
  },
  "requirement_id": "REQ-CODEX-006",
  "subject": {
    "kind": "codex_adapter_claim",
    "subject_id": "codex-adapter:claim-v1",
    "schema": "contracts/schemas/codex-adapter-claim-manifest.schema.json",
    "sha256": "de873c92604712cfa65e0bd48457fa53224570dd86a5219157d075ff7994b747"
  },
  "input_digests": [
    {
      "ordinal": 0,
      "label": "requirements",
      "path": "normative/requirements.json",
      "sha256": "2c112fe3248cb6ab3d3eebdf1801435c22827c2c5aa155edff4cd86285c37489"
    },
    {
      "ordinal": 1,
      "label": "boundary",
      "path": "contracts/codex-intelligence-adapter/boundary.json",
      "sha256": "ebd492711cb60b22e316d2703d2c22d928ceb63d49022582b1aa2398a5911dc7"
    },
    {
      "ordinal": 2,
      "label": "authentication",
      "path": "contracts/codex-intelligence-adapter/authentication-prerequisite.json",
      "sha256": "34694252b7eaa71d3da78bcf9447370766b53397a48a20f1159938005938c2b9"
    },
    {
      "ordinal": 3,
      "label": "capability",
      "path": "contracts/codex-intelligence-adapter/capability-proof.json",
      "sha256": "71923d793b2a081a3349ac74f8049863d482dfbcf853b73a978b8e5bb4387e44"
    },
    {
      "ordinal": 4,
      "label": "network",
      "path": "contracts/codex-intelligence-adapter/network-proof.json",
      "sha256": "1bba1d77be7e50e44c3503c8aac0384e1fbcc004a62df8ba8bd6ad6ea2400445"
    },
    {
      "ordinal": 5,
      "label": "fixture_manifest",
      "path": "contracts/codex-intelligence-adapter/fixture-manifest.json",
      "sha256": "cfab1bab2c269080a2b01a2bf6dc22d18b5fb488d04d429fdf3838f7970070dd"
    }
  ],
  "output_digests": [
    {
      "ordinal": 0,
      "label": "codex_adapter_evidence",
      "path": "conformance/evidence/codex-adapter-evidence.json",
      "sha256": "228146d632c7fc19b1788f72a2257f970b7653c81489b6dcfa05b7dd14969c5e"
    },
    {
      "ordinal": 1,
      "label": "recovery_report",
      "path": "conformance/evidence/codex-adapter-recovery-report.json",
      "sha256": "e3df941781c06450b7ff5c895311bf63cb276bb01504526f1b779167f14b2081"
    }
  ],
  "receipts": [
    {
      "ordinal": 0,
      "receipt_id": "receipt:codex-adapter-profile",
      "receipt_type": "EvidenceValidationReceipt",
      "path": "conformance/evidence/codex-adapter-recovery-report.json",
      "sha256": "e3df941781c06450b7ff5c895311bf63cb276bb01504526f1b779167f14b2081"
    }
  ],
  "artifact_digests": [
    {
      "ordinal": 0,
      "label": "profile",
      "path": "contracts/codex-intelligence-adapter/profile.json",
      "sha256": "5fe6130f3807b3d75a03ae9f4dff002bd55b904a6ea5924f7f94c946af76fe98"
    },
    {
      "ordinal": 1,
      "label": "normative_contract",
      "path": "normative/codex-intelligence-adapter-profile.md",
      "sha256": "92beea18078105b17c9d50fa8ab2568cc556b84d9c39a825227b36f6aef1da63"
    }
  ],
  "execution_context": {
    "runner_id": "mdplace.package-validator",
    "platform": "platform_neutral",
    "architecture": "architecture_neutral",
    "filesystem": "package_fixture",
    "locale": "C.UTF-8",
    "timezone": "UTC",
    "network_access": "denied"
  },
  "verdict": "pass",
  "codes": []
}
